[
  {
    "id": "stt-001",
    "audio_path": "data/golden/stt/audio/stt_sample_001.wav",
    "expected": {
      "process_name": "압출",
      "quantity": 53,
      "notes": "작업 완료 수량 53건 기록됨."
    },
    "metadata": {
      "dialect": "standard",
      "noise_level": "75dB",
      "gender": "M",
      "age_group": "20s",
      "speaker_id": "spk-001",
      "transcript": "압출 공정 현재 작업 완료 수량은 53개입니다."
    }
  },
  {
    "id": "stt-002",
    "audio_path": "data/golden/stt/audio/stt_sample_002.wav",
    "expected": {
      "process_name": "조립",
      "quantity": 56,
      "notes": "작업 완료 수량 56건 기록됨."
    },
    "metadata": {
      "dialect": "standard",
      "noise_level": "80dB",
      "gender": "M",
      "age_group": "30s",
      "speaker_id": "spk-002",
      "transcript": "조립 공정 현재 작업 완료 수량은 56개입니다."
    }
  },
  {
    "id": "stt-003",
    "audio_path": "data/golden/stt/audio/stt_sample_003.wav",
    "expected": {
      "process_name": "도색",
      "quantity": 59,
      "notes": "작업 완료 수량 59건 기록됨."
    },
    "metadata": {
      "dialect": "standard",
      "noise_level": "85dB",
      "gender": "M",
      "age_group": "40s",
      "speaker_id": "spk-003",
      "transcript": "도색 공정 현재 작업 완료 수량은 59개입니다."
    }
  },
  {
    "id": "stt-004",
    "audio_path": "data/golden/stt/audio/stt_sample_004.wav",
    "expected": {
      "process_name": "연마",
      "quantity": 62,
      "defect_code": "D-004",
      "notes": "작업 완료 수량 62건 기록됨. 치수 불량 불량 건 기록."
    },
    "metadata": {
      "dialect": "standard",
      "noise_level": "75dB",
      "gender": "M",
      "age_group": "50s",
      "speaker_id": "spk-004",
      "transcript": "연마 공정 현재 작업 완료 수량은 62개입니다. 추가 특이사항으로 치수 불량 불량이 발생하여 코드 D-004로 접수합니다."
    }
  },
  {
    "id": "stt-005",
    "audio_path": "data/golden/stt/audio/stt_sample_005.wav",
    "expected": {
      "process_name": "가공",
      "quantity": 65,
      "notes": "작업 완료 수량 65건 기록됨."
    },
    "metadata": {
      "dialect": "standard",
      "noise_level": "80dB",
      "gender": "M",
      "age_group": "60s",
      "speaker_id": "spk-005",
      "transcript": "가공 공정 현재 작업 완료 수량은 65개입니다."
    }
  },
  {
    "id": "stt-006",
    "audio_path": "data/golden/stt/audio/stt_sample_006.wav",
    "expected": {
      "process_name": "검사",
      "quantity": 68,
      "notes": "작업 완료 수량 68건 기록됨."
    },
    "metadata": {
      "dialect": "standard",
      "noise_level": "85dB",
      "gender": "F",
      "age_group": "20s",
      "speaker_id": "spk-006",
      "transcript": "검사 공정 현재 작업 완료 수량은 68개입니다."
    }
  },
  {
    "id": "stt-007",
    "audio_path": "data/golden/stt/audio/stt_sample_007.wav",
    "expected": {
      "process_name": "포장",
      "quantity": 71,
      "notes": "작업 완료 수량 71건 기록됨."
    },
    "metadata": {
      "dialect": "standard",
      "noise_level": "75dB",
      "gender": "F",
      "age_group": "30s",
      "speaker_id": "spk-007",
      "transcript": "포장 공정 현재 작업 완료 수량은 71개입니다."
    }
  },
  {
    "id": "stt-008",
    "audio_path": "data/golden/stt/audio/stt_sample_008.wav",
    "expected": {
      "process_name": "압출",
      "quantity": 74,
      "defect_code": "D-003",
      "notes": "작업 완료 수량 74건 기록됨. 찍힘 불량 건 기록."
    },
    "metadata": {
      "dialect": "standard",
      "noise_level": "80dB",
      "gender": "F",
      "age_group": "40s",
      "speaker_id": "spk-008",
      "transcript": "압출 공정 현재 작업 완료 수량은 74개입니다. 추가 특이사항으로 찍힘 불량이 발생하여 코드 D-003로 접수합니다."
    }
  },
  {
    "id": "stt-009",
    "audio_path": "data/golden/stt/audio/stt_sample_009.wav",
    "expected": {
      "process_name": "조립",
      "quantity": 77,
      "notes": "작업 완료 수량 77건 기록됨."
    },
    "metadata": {
      "dialect": "standard",
      "noise_level": "85dB",
      "gender": "F",
      "age_group": "50s",
      "speaker_id": "spk-009",
      "transcript": "조립 공정 현재 작업 완료 수량은 77개입니다."
    }
  },
  {
    "id": "stt-010",
    "audio_path": "data/golden/stt/audio/stt_sample_010.wav",
    "expected": {
      "process_name": "도색",
      "quantity": 80,
      "notes": "작업 완료 수량 80건 기록됨."
    },
    "metadata": {
      "dialect": "standard",
      "noise_level": "75dB",
      "gender": "F",
      "age_group": "60s",
      "speaker_id": "spk-010",
      "transcript": "도색 공정 현재 작업 완료 수량은 80개입니다."
    }
  },
  {
    "id": "stt-011",
    "audio_path": "data/golden/stt/audio/stt_sample_011.wav",
    "expected": {
      "process_name": "연마",
      "quantity": 83,
      "notes": "작업 완료 수량 83건 기록됨."
    },
    "metadata": {
      "dialect": "gyeongsang",
      "noise_level": "80dB",
      "gender": "M",
      "age_group": "20s",
      "speaker_id": "spk-011",
      "transcript": "연마 공정 말임더, 오늘 작업 수량은 총 83개이고예."
    }
  },
  {
    "id": "stt-012",
    "audio_path": "data/golden/stt/audio/stt_sample_012.wav",
    "expected": {
      "process_name": "가공",
      "quantity": 86,
      "defect_code": "D-002",
      "notes": "작업 완료 수량 86건 기록됨. 크랙 불량 건 기록."
    },
    "metadata": {
      "dialect": "gyeongsang",
      "noise_level": "85dB",
      "gender": "M",
      "age_group": "40s",
      "speaker_id": "spk-012",
      "transcript": "가공 공정 말임더, 오늘 작업 수량은 총 86개이고예. 근데 고마 크랙 불량이 좀 나와가꼬 코드 D-002로 등록하겠심더."
    }
  },
  {
    "id": "stt-013",
    "audio_path": "data/golden/stt/audio/stt_sample_013.wav",
    "expected": {
      "process_name": "검사",
      "quantity": 89,
      "notes": "작업 완료 수량 89건 기록됨."
    },
    "metadata": {
      "dialect": "gyeongsang",
      "noise_level": "75dB",
      "gender": "F",
      "age_group": "30s",
      "speaker_id": "spk-013",
      "transcript": "검사 공정 말임더, 오늘 작업 수량은 총 89개이고예."
    }
  },
  {
    "id": "stt-014",
    "audio_path": "data/golden/stt/audio/stt_sample_014.wav",
    "expected": {
      "process_name": "포장",
      "quantity": 92,
      "notes": "작업 완료 수량 92건 기록됨."
    },
    "metadata": {
      "dialect": "gyeongsang",
      "noise_level": "80dB",
      "gender": "F",
      "age_group": "50s",
      "speaker_id": "spk-014",
      "transcript": "포장 공정 말임더, 오늘 작업 수량은 총 92개이고예."
    }
  },
  {
    "id": "stt-015",
    "audio_path": "data/golden/stt/audio/stt_sample_015.wav",
    "expected": {
      "process_name": "압출",
      "quantity": 95,
      "notes": "작업 완료 수량 95건 기록됨."
    },
    "metadata": {
      "dialect": "jeolla",
      "noise_level": "85dB",
      "gender": "M",
      "age_group": "30s",
      "speaker_id": "spk-015",
      "transcript": "압출 작업 수량 95개 채웠당께요."
    }
  },
  {
    "id": "stt-016",
    "audio_path": "data/golden/stt/audio/stt_sample_016.wav",
    "expected": {
      "process_name": "조립",
      "quantity": 98,
      "defect_code": "D-001",
      "notes": "작업 완료 수량 98건 기록됨. 스크래치 불량 건 기록."
    },
    "metadata": {
      "dialect": "jeolla",
      "noise_level": "75dB",
      "gender": "F",
      "age_group": "20s",
      "speaker_id": "spk-016",
      "transcript": "조립 작업 수량 98개 채웠당께요. 아 참말로 스크래치 한 건 났응게 코드 D-001 적어주쇼잉."
    }
  },
  {
    "id": "stt-017",
    "audio_path": "data/golden/stt/audio/stt_sample_017.wav",
    "expected": {
      "process_name": "도색",
      "quantity": 101,
      "notes": "작업 완료 수량 101건 기록됨."
    },
    "metadata": {
      "dialect": "jeolla",
      "noise_level": "80dB",
      "gender": "F",
      "age_group": "40s",
      "speaker_id": "spk-017",
      "transcript": "도색 작업 수량 101개 채웠당께요."
    }
  },
  {
    "id": "stt-018",
    "audio_path": "data/golden/stt/audio/stt_sample_018.wav",
    "expected": {
      "process_name": "연마",
      "quantity": 104,
      "notes": "작업 완료 수량 104건 기록됨."
    },
    "metadata": {
      "dialect": "chungcheong",
      "noise_level": "85dB",
      "gender": "M",
      "age_group": "50s",
      "speaker_id": "spk-018",
      "transcript": "여기 연마 공정인디유, 수량 104개 완료했슈."
    }
  },
  {
    "id": "stt-019",
    "audio_path": "data/golden/stt/audio/stt_sample_019.wav",
    "expected": {
      "process_name": "가공",
      "quantity": 107,
      "notes": "작업 완료 수량 107건 기록됨."
    },
    "metadata": {
      "dialect": "chungcheong",
      "noise_level": "75dB",
      "gender": "M",
      "age_group": "60s",
      "speaker_id": "spk-019",
      "transcript": "여기 가공 공정인디유, 수량 107개 완료했슈."
    }
  },
  {
    "id": "stt-020",
    "audio_path": "data/golden/stt/audio/stt_sample_020.wav",
    "expected": {
      "process_name": "검사",
      "quantity": 110,
      "defect_code": "D-005",
      "notes": "작업 완료 수량 110건 기록됨. 이물 불량 건 기록."
    },
    "metadata": {
      "dialect": "chungcheong",
      "noise_level": "80dB",
      "gender": "F",
      "age_group": "30s",
      "speaker_id": "spk-020",
      "transcript": "여기 검사 공정인디유, 수량 110개 완료했슈. 근디 이물 불량 있는 것 같은디, 코드 D-005 맞아유?"
    }
  },
  {
    "id": "stt-021",
    "audio_path": "data/golden/stt/audio/stt_sample_021.wav",
    "expected": {
      "process_name": "포장",
      "quantity": 113,
      "notes": "작업 완료 수량 113건 기록됨."
    },
    "metadata": {
      "dialect": "standard",
      "noise_level": "85dB",
      "gender": "M",
      "age_group": "20s",
      "speaker_id": "spk-001",
      "transcript": "포장 공정 현재 작업 완료 수량은 113개입니다."
    }
  },
  {
    "id": "stt-022",
    "audio_path": "data/golden/stt/audio/stt_sample_022.wav",
    "expected": {
      "process_name": "압출",
      "quantity": 116,
      "notes": "작업 완료 수량 116건 기록됨."
    },
    "metadata": {
      "dialect": "standard",
      "noise_level": "75dB",
      "gender": "M",
      "age_group": "30s",
      "speaker_id": "spk-002",
      "transcript": "압출 공정 현재 작업 완료 수량은 116개입니다."
    }
  },
  {
    "id": "stt-023",
    "audio_path": "data/golden/stt/audio/stt_sample_023.wav",
    "expected": {
      "process_name": "조립",
      "quantity": 119,
      "notes": "작업 완료 수량 119건 기록됨."
    },
    "metadata": {
      "dialect": "standard",
      "noise_level": "80dB",
      "gender": "M",
      "age_group": "40s",
      "speaker_id": "spk-003",
      "transcript": "조립 공정 현재 작업 완료 수량은 119개입니다."
    }
  },
  {
    "id": "stt-024",
    "audio_path": "data/golden/stt/audio/stt_sample_024.wav",
    "expected": {